p_answer1,p_answer2,p_classify,p_qdetail1,p_qdetail2,p_qdetail3,p_title
"黄斑裂孔病变位于眼底的后极部。位于这个区域的疾病多会造成明显的视力下降,色觉异常，视物变形的症状。",,晶状体混浊,"
					大夫您好:快给我看看能不能治好特发性黄斑裂孔（板层）男67岁吉林延吉人今年4月6日去延边医院眼科看病得出了这种病，大夫说赶紧手术不然来不及了，说的好严重我也好怕但是动刀子的是不是小是因到这里来请各位专家指导提出宝贵的建议。我呀左眼睛好象进了什么东西似的有时看不清搂一搂就好一点这样的症状已经很长时间了，我以为血压上去了疲劳的关系呢，我				",,,专家：快给我看看能不能治好特发性黄斑裂孔（板层）
你好，基本视力稳定，不下降，基本是可以继续保守观察，一般原来医院就行的啊。,,晶状体混浊,"
					特发性眼底黄斑裂孔。单眼，正视-视物变形，弯曲缺失；侧视-上课，但不全，视野受限；发病时间不详，确诊时间为2010年7月，目前医院复查为老年特发性黄斑裂孔四期。2010年9月-11月曾服用德胜门中医院中药进行治疗，目前视力:好眼-1.0；病眼-0.125，与服药之前对比，视力稳定未下降。1.该病症能否保守治疗；2.如必须手术，手效果好的话能保持多长时间；3.成功的几率有多大，视力能否提高；4.北京市哪一家医院比较擅长做该类手术；5.能否推荐几位比较擅长治疗该类疾病的医生。				",,,特发性黄斑裂孔
基本病因与眼前节的解剖结构尤其与房角状态有关另外情绪激动、长时间在暗环境工作及近距离阅读、气候变化、季节更替都可能导致它的急性发作。,,晶状体青光眼...,"
					,最近感觉眼睛不是很舒服稍微一看电视就会感觉疼痛看远处也是看不清经常会用手察眼睛去医院检查医生说是晶状体青光眼斑,				",晶状体青光眼斑是什么原因翱（,,最近感觉眼睛不是很舒服稍微一看电视就会感觉疼痛看远...
视网膜色素变性。,,晶状体混浊,"
					,20多岁劳动时被竹签刺中左眼，没多久失明。逐渐视神经萎缩。因受影响，右眼2008年1月，做了“视网膜脱离修复”手术。2014年9月，右眼又做了“白内障”手术和“视网膜黄斑裂口修复”手术。现右眼视网膜色素变性，视力在0.1，看物模糊，配眼镜校正不了视力。,				",左眼失明右眼并发性白内障特发性黄斑裂孔，视网膜脱离修复术后视网膜色素变性。,下一步如何治疗？,20多岁劳动时被竹签刺中左眼，没多久失明。逐渐视神经...
您好；晶状体青光眼斑基本病因与眼前节的解剖结构尤其与房角状态有关，另外情绪激动、长时间在暗环境工作及近距离阅读、气候变化、季节更替都可能导致它的急性发作。,,晶状体青光眼...,"
					,邻居王奶奶最近眼睛不舒服去医院做了个检查医生说是患了晶状体青光眼斑请问一下这个晶状体青光眼斑是什么原因引起的呢？,				",晶状体青光眼斑是什么原因引起的？（,,邻居王奶奶最近眼睛不舒服去医院做了个检查医生说是患...
您好；晶状体青光眼斑基本病因与眼前节的解剖结构尤其与房角状态有关，另外情绪激动、长时间在暗环境工作及近距离阅读、气候变化、季节更替都可能导致它的急性发作。,,晶状体青光眼...,"
					,邻居王奶奶最近眼睛不舒服去医院做了个检查医生说是患了晶状体青光眼斑请问一下这个晶状体青光眼斑是什么原因引起的呢？,				",晶状体青光眼斑是什么原因引起的？（,,邻居王奶奶最近眼睛不舒服去医院做了个检查医生说是患...
基本病因与眼前节的解剖结构尤其与房角状态有关另外情绪激动、长时间在暗环境工作及近距离阅读、气候变化、季节更替都可能导致它的急性发作。,,晶状体青光眼...,"
					,最近感觉眼睛不是很舒服稍微一看电视就会感觉疼痛看远处也是看不清经常会用手察眼睛去医院检查医生说是晶状体青光眼斑,				",晶状体青光眼斑是什么原因翱（,,最近感觉眼睛不是很舒服稍微一看电视就会感觉疼痛看远...
你好青光眼斑：严重的急性闭角型青光眼可以引起晶状体改变在瞳孔区之晶状体前囊下可见半透明瓷白色或乳白色混浊斑点称青光眼斑。,,晶状体青光眼...,"
					,我有一个亲戚他就是工作的原因吧经常得站在外面吹风所以最近眼睛不舒服去医院做了个检查医生说是患了晶状体青光眼斑现在正在治疗我想要了解一下这种情况,				",晶状体青光眼斑的症状是什么？（,,我有一个亲戚他就是工作的原因吧经常得站在外面吹风所...
您好！您说的情况我已获悉。可以滴用氧氟沙星眼药水，涂抹抗生素眼药膏，纱布外敷眼睛。同时静滴抗生素治疗。,,睑结膜充血露...,"
					绿脓杆菌性角膜溃疡系绿脓杆菌直接侵入角膜引起感染所致。该菌为革兰氏阴性小杆菌，营养要求不高，它广泛存在于自然界的土壤、污水及空气中，亦可寄生于体表乃至结膜囊内。最适宜的繁殖温度为30～37℃，能产生荧光素和绿脓素。应该怎么治疗？				",,,绿脓杆菌性角膜溃疡应该怎么治疗？
你好，你这个情况应该是可以治好的但是晶状体青光眼斑很容易变成白内障，白内障一旦引起的黑点增多就会视网膜脱离到时候就真的难以治疗了，所以建议你最好尽快去正规的眼科医院必要的话可以手术治疗最好了。,,晶状体青光眼...,"
					,我看东西时间久了眼睛就会感觉疲劳而且还有点散光的现象现在视力下降的更加厉害了看东西的时候经常是模糊不清甚至会有重影出现了去医院检查是有了青光眼斑现在我担心以后眼睛就要看不见了,				",青年的晶状体青光眼斑还可以治愈吗？（,,我看东西时间久了眼睛就会感觉疲劳而且还有点散光的现...
注意进行对症的补充营养的调理就可以的，加强对症的消炎进行控制。,,睑结膜充血露...,"
					我的工作是从事钢铁焊接的，昨天上午在工作的时候，一位同事说他的眼睛特别疼痛，视力有点模糊，我看到他的眼睛发生红肿了，还流泪，赶紧给他滴了一些眼药水，直到晚上下班，和他一起去了医院，经检查是绿脓杆菌性角膜溃疡。绿脓杆菌性角膜溃疡的预防方法是什么？				",,,绿脓杆菌性角膜溃疡应该怎么预防
你好你这个情况应该是可以治好的但是晶状体青光眼斑很容易变成白内障白内障一旦引起的黑点增多就会视网膜脱离到时候就真的难以治疗了所以建议你最好尽快去正规的眼科医院必要的话可以手术治疗最好了,,晶状体青光眼...,"
					,我看东西时间久了眼睛就会感觉疲劳而且还有点散光的现象现在视力下降的更加厉害了看东西的时候经常是模糊不清甚至会有重影出现了去医院检查是有了青光眼斑现在我担心以后眼睛就要看不见了,				",青年的晶状体青光眼斑还可以治愈吗？（,,我看东西时间久了眼睛就会感觉疲劳而且还有点散光的现...
根据你说的情况，绿脓杆菌性角膜溃疡是比较严重的疾病，发展特别快，甚至24小时可能造成角膜穿孔,,睑结膜充血露...,"
					我的工作是从事钢铁焊接的，昨天上午在工作的时候，一位同事说他的眼睛特别疼痛，视力有点模糊，我看到他的眼睛发生红肿了，还流泪，赶紧给他滴了一些眼药水，直到晚上下班，和他一起去了医院，经检查是绿脓杆菌性角膜溃疡。绿脓杆菌性角膜溃疡的预防方法是什么？				",,,绿脓杆菌性角膜溃疡应该怎么预防
你好， 高度近视在稳定期还可以选择激光手术恢复正常视力，建议你每天坚持做眼睛保健操，只要坚持也是辅助近视矫正恢复的。,,近视弧,"
					常年近视，右眼不到0.1，左眼基本看不见。近年更是双眼模糊，稍一看书或看电视就流泪刺痛。在县医院做数字图像检查影像所见:双眼视网膜呈豹纹状，乳头颞侧见近视弧形斑，后极部视网膜可见色素上皮萎缩灶，黄斑区色素紊乱，中央光反射消失;检查结果:高度近视性视网膜病变并黄斑变性。没有进行过治疗。请问:什么是高度近视性视网膜病变并黄斑变性？各有哪些后果？应怎样防治？继续从事教书对我的眼睛有何利弊？				",,,高度近视性视网膜病变并黄斑变性
您3.30远周边区部见片状变性区强荧光灶，必要时得做手术治疗的，建议您积极配合医生治疗吧，毕竟每个人的病情都是不尽相同的。,,近视弧,"
					右眼中浆，周边视网膜变性视盘界清色正常，颞侧近视弧。视网膜血管行径正常。A一CRT正常，视盘荧光正常。黄斑区色素紊乱，点状渗出，动静脉期中心凹下方可见点状强荧光，晚期荧光形态无变化。3.30远周边区部见片状变性区强荧光灶。能否光凝，该怎么治疗？				",,,右眼中浆，周边视网膜变性
根据你说的情况，绿脓杆菌性角膜炎是比较严重的角膜炎，发展比较快，严重患者24小时可能造成角膜穿孔,,睑结膜充血露...,"
					我本来视力就不好，遗传的。进入高中的后，学业加重了用眼过度，经常感到酸涩胀痛，就用了一点眼药水。可是最近突然的眼睛出现红肿、疼痛，莫名其妙的流泪，确诊为绿脓杆菌性角膜溃疡。绿脓杆菌性角膜溃疡可以吃什么食物调节？				",,,绿脓杆菌性角膜溃疡可以吃什么食物调节？
绿脓杆菌性角膜溃疡是角膜溃疡中最严重的类型，建议积极采取药物治疗。饮食调节只能起辅助作用。,,睑结膜充血露...,"
					我本来视力就不好，遗传的。进入高中的后，学业加重了用眼过度，经常感到酸涩胀痛，就用了一点眼药水。可是最近突然的眼睛出现红肿、疼痛，莫名其妙的流泪，确诊为绿脓杆菌性角膜溃疡。绿脓杆菌性角膜溃疡可以吃什么食物调节？				",,,绿脓杆菌性角膜溃疡可以吃什么食物调节？
你好，一般需要进行细致的检查治疗的，需要注意好饮食合理性,,近视弧,"
					近视弧如果度数稳定后会不会继续发展				",,,近视弧如果度数稳定后会不会继续
你好，一般需要进行细致的检查治疗的，需要注意好饮食合理性,,近视弧,"
					近视弧如果度数稳定后会不会继续发展				",,,近视弧如果度数稳定后会不会继续
"100-3000度的近视都可治疗,对高度近视患者已经在成功开展了多种治疗方法，都有不同的适应症和特点，至于您的情况能否手术还需到医院严格检查，并排除弱视、斜视等眼部疾患，如通过检查，手术是安全的。",,近视弧,"
					常年近视，右眼不到0.1，左眼基本看不见。近年更是双眼模糊，稍一看书或看电视就流泪刺痛。在县医院做数字图像检查影像所见:双眼视网膜呈豹纹状，乳头颞侧见近视弧形斑，后极部视网膜可见色素上皮萎缩灶，黄斑区色素紊乱，中央光反射消失;检查结果:高度近视性视网膜病变并黄斑变性。没有进行过治疗。请问:什么是高度近视性视网膜病变并黄斑变性？各有哪些后果？应怎样防治？继续从事教书对我的眼睛有何利弊？				",,,高度近视性视网膜病变并黄斑变性
"100-3000度的近视都可治疗,对高度近视患者已经在成功开展了多种治疗方法，都有不同的适应症和特点，至于您的情况能否手术还需到医院严格检查，并排除弱视、斜视等眼部疾患，如通过检查，手术是安全的。",,近视弧,"
					常年近视，右眼不到0.1，左眼基本看不见。近年更是双眼模糊，稍一看书或看电视就流泪刺痛。在县医院做数字图像检查影像所见:双眼视网膜呈豹纹状，乳头颞侧见近视弧形斑，后极部视网膜可见色素上皮萎缩灶，黄斑区色素紊乱，中央光反射消失;检查结果:高度近视性视网膜病变并黄斑变性。没有进行过治疗。请问:什么是高度近视性视网膜病变并黄斑变性？各有哪些后果？应怎样防治？继续从事教书对我的眼睛有何利弊？				",,,高度近视性视网膜病变并黄斑变性
你好，根据你描述的这种情况来看眼睛出现了一些黄斑以及局部代谢问题会造成一些眼睛功能障碍视力下降应该进行调整。,,近视弧,"
					,眼底镜检查提示：右眼黄斑病变病因与慢性光损害、营养失调、中毒、免疫失调性疾病有关，建议积极治疗原发病，定期进行眼底检查，关注变化，如有症状请专科治疗。眼底	右眼豹纹状眼底，视乳头颞侧有灰白色近视弧形斑。右眼黄斑区色素脱失，中心凹反光不清我以前做过激光手术，做激光手术之前左眼700度，右眼950度，2005年做完激光手术之后双眼都在1.0左右，由于工作长期用电脑，造成右眼下降很明显，目前右眼只有0.2并有黄斑病变。有咨询过湖北省中医院的医生，医生说目前没有比较好的方法控制，平时尽量防止视力疲劳。,				",做过眼底检查,想咨询下是否有中医的理疗方法来缓解或减轻症状呢？多谢,眼底镜检查提示：右眼黄斑病变病因与慢性光损害、营养...
您好，药物或者仪器矫正近视眼，只针对假性近视或许还有效果。800度，这属于高度近视范畴。当然使用电脑过久会造成眼部疲劳。目前矫正近视方法就两种，配镜和近视眼激光手术。,,近视弧,"
					,最近双眼视力下降厉害，矫正只能到4.0，再无法提高，视野模糊，平时出行看不清路况，特别是对台阶辨认差。另外最近本人颈椎不好，老头疼。,				",做眼部造影结果：视盘界清、色淡，颞侧近视弧。视网膜血管行经正常。中心凹光反射不清。FFA:A-RCT正常。双眼视盘荧光充盈正常，晚期无渗漏。黄斑区未见异常荧光。右眼颞侧远周边部视网膜血管壁渗漏荧光。ICGA：双眼后极部及周边部脉络未见异常荧光。诊断高度近视性脉络膜视网膜病变。,出现这种情况的原因是什么？眼部是否做进一步检查？是否有病变？能否提高矫正视力？,最近双眼视力下降厉害，矫正只能到4.0，再无法提高，视...
这是高度近视视网膜病变。要正规验光配镜矫正视力，注意用眼卫生不要过于疲劳，可以延缓近视发展。如果近视发展较快可以做后巩膜加固术。,,近视弧,"
					,眼底	双眼豹纹状眼底，视乳头颞侧有灰白色近视弧形斑。右眼矫正视力	4.9/0.8左眼矫正视力	4.9/0.8色觉	正常眼睑	未见异常泪器	未见异常结膜	未见异常眼球	未见异常角膜	未见异常前房	未见异常虹膜	未见异常瞳孔	未见异常晶状体	未见异常玻璃体	未见异常杯盘比	正常体检所见	双眼屈光不正(矫正视力低于正常标准5.0/1.0)双眼近视眼底				",,,眼底	双眼豹纹状眼底，视乳头颞侧有灰白色近视弧形斑。...
这是高度近视视网膜病变。要正规验光配镜矫正视力，注意用眼卫生不要过于疲劳，可以延缓近视发展。如果近视发展较快可以做后巩膜加固术。,,近视弧,"
					,眼底	双眼豹纹状眼底，视乳头颞侧有灰白色近视弧形斑。右眼矫正视力	4.9/0.8左眼矫正视力	4.9/0.8色觉	正常眼睑	未见异常泪器	未见异常结膜	未见异常眼球	未见异常角膜	未见异常前房	未见异常虹膜	未见异常瞳孔	未见异常晶状体	未见异常玻璃体	未见异常杯盘比	正常体检所见	双眼屈光不正(矫正视力低于正常标准5.0/1.0)双眼近视眼底				",,,眼底	双眼豹纹状眼底，视乳头颞侧有灰白色近视弧形斑。...
你好，眼袋是眼睛周围皮下的色素沉着和毛细血管增生形成的。 在中医上眼袋发黑与肾有关系，属于肾虚的范畴，可以吃点滋 阴的中药，比如,,金鱼眼,"
					如何消除金鱼眼？上眼皮肿				",,,如何消除金鱼眼？上眼皮肿
建议 您可以使用地塞米松治疗的，再配合口服左氧氟沙星缓解症状的，对于您的情况还是会有帮助的。,,金鱼眼,"
					,我弟弟41岁，甲亢2年，基本恢复正常，单眼睛突出，布满血丝，睡觉不好。听说有一种药可以搽好。是什么药膏啊。,				",是，说是金鱼眼，,找药，听别人说在上海有一种药可以搽的药膏。,我弟弟41岁，甲亢2年，基本恢复正常，单眼睛突出，布满...
您好，回答您关于做近视眼手术年纪的问题。 近视眼手术从临床的角度讲，18岁左右以上的都可以做的。只要度数没再增长即可。,,金鱼眼,"
					我现在一只眼睛有830度近视，2只眼睛差不多一样的近视程度，有170高160斤重，眼睛哪里像金鱼眼一样恐怖，是因为我胖还是我高度近视才会出现金鱼眼的？如果是我胖我减肥瘦到120斤左右就不会有金鱼眼了吧？				",,,我现在一只眼睛有830度近视，
您好，回答您关于做近视眼手术年纪的问题。 近视眼手术从临床的角度讲，18岁左右以上的都可以做的。只要度数没再增长即可。,,金鱼眼,"
					我现在一只眼睛有830度近视，2只眼睛差不多一样的近视程度，有170高160斤重，眼睛哪里像金鱼眼一样恐怖，是因为我胖还是我高度近视才会出现金鱼眼的？如果是我胖我减肥瘦到120斤左右就不会有金鱼眼了吧？				",,,我现在一只眼睛有830度近视，
请尽可能详细地描述您想 要咨询的内容，如发病时间、症状、进行过哪些治疗，以及想要得到怎样的帮助 等， 以便您能够得到更准确的回答。,,金鱼眼,"
					这十年以内会发生眼睛的那些疾病，而且听说十年之后是视力会再下降，我就不想去做了，但是我现在才十六岁我不想戴着金鱼眼过一辈子你有什么办法帮我吗？求解答				",,,这十年以内会发生眼睛的那些疾病
您好，长时间对电脑用眼，肯定会对视力有影响，根据您描述还不能够十分肯定就是近视眼，也可能其他眼病引起。近视眼的症状里面就存在视物模糊的感觉。如果是近视眼，那么应该根据情况进行近视治疗。,,金鱼眼,"
					如果是因为我高度近视哪还有没有补救的办法我才16岁。我听说成年以后可以做近视眼手上，但是只能维持十年，所以我不打算做手术，但是我也不想一辈子都是金鱼眼。求解答				",,,如果是因为我高度近视哪还有没有
您好，长时间对电脑用眼，肯定会对视力有影响，根据您描述还不能够十分肯定就是近视眼，也可能其他眼病引起。近视眼的症状里面就存在视物模糊的感觉。如果是近视眼，那么应该根据情况进行近视治疗。,,金鱼眼,"
					如果是因为我高度近视哪还有没有补救的办法我才16岁。我听说成年以后可以做近视眼手上，但是只能维持十年，所以我不打算做手术，但是我也不想一辈子都是金鱼眼。求解答				",,,如果是因为我高度近视哪还有没有
,,金鱼眼,"
					,13岁可不可以带隐形眼镜？我现在眼睛有点变形了，度数325度，没有散光如果是做手术的话，最好，好多岁做？,				",不想变成金鱼眼，想摆脱眼镜,,13岁可不可以带隐形眼镜？我现在眼睛有点变形了，度数...
你好，这种情况是由于眼轴比较长导致的，这种情况是没有办法治疗恢复的。,,金鱼眼,"
					高中开始近视，现在近视度数300和350，眼睛往外突出，看起来像金鱼眼，有什么办法使眼睛突出恢复吗？				",,,高中开始近视，现在近视度数30
你好，炎症感染的问题需要做好消炎治疗，需要注意好饮食合理性，需要调整好自己的心态,,睑结膜充血露...,"
					我最近休息的晚，眼睛视力模糊，总是通红的，并且很疼，我以为是休息不好我就没有去医院，今天我一个同事说我眼睛好严重，好像是绿脓杆菌性角膜溃疡，我想知道这个病是射门症状啊？我这个情况和这个一样吗？绿脓杆菌性角膜溃疡有什么症状我想对比下自己啊？				",,,绿脓杆菌性角膜溃疡的症状有哪些？
你好，炎症感染的问题需要做好消炎治疗，需要注意好饮食合理性，需要调整好自己的心态,,睑结膜充血露...,"
					我最近休息的晚，眼睛视力模糊，总是通红的，并且很疼，我以为是休息不好我就没有去医院，今天我一个同事说我眼睛好严重，好像是绿脓杆菌性角膜溃疡，我想知道这个病是射门症状啊？我这个情况和这个一样吗？绿脓杆菌性角膜溃疡有什么症状我想对比下自己啊？				",,,绿脓杆菌性角膜溃疡的症状有哪些？
正确地诊断原发眼病对于晶状体皱缩是至关重要晶状体浑浊的形态和位置有助于诊断患者有原发眼病的表现常为单眼由眼前段疾病引起的多由前皮质开始由眼后段疾病引起者则先于晶状体后极部囊膜及囊膜下皮质出现颗粒状灰黄色浑浊,,晶状体皱缩,"
					,我的奶奶最近眼睛老是感觉不怎么舒服现在看东西是越来越没有以前清晰了都快变成瞎子了听医生说是什么晶状体皱缩我想了解一下像这种病该如何诊断呢？请问晶状体皱缩应该如何诊断？,				",,,晶状体皱缩应该如何诊断？
隆鼻主要是将隆鼻填充物注入爱美者鼻梁处所存在的凹陷部位通过注射的方法加以修整，从而达到隆鼻的目的。,,金鱼眼,"
					金鱼眼先天性金鱼眼可以通过一些眼霜和按摩去除吗？必须通过🌳手术吗？				",,,金鱼眼
建议您首先不要太着急了保持好良好的心态非常重要另外如果长时间没有好转的话建议您到医院进行一下检查谢谢,,晶状体皱缩,"
					,最近一个月发现自己的眼睛最近的感觉不太好很明显的感觉到了自己的眼睛里的晶状体有些缩小朋友说我这是晶状体皱缩的表现和症状现在自己很担心会不会影响到自己的以后的生活晶状体皱缩怎么治疗？,				",,,晶状体皱缩应该如何治疗？
由于眼部炎症或退行性蹭使晶状体营养或代谢发生障碍导致浑浊常见于葡萄膜炎、视网膜色素变性、视网膜脱离、青光眼、眼内肿瘤、高度近视及低眼压等,,晶状体皱缩,"
					,这两天总是感觉眼睛有些不舒服看东西的时候也不清楚跟以前比模糊了好多点了几天的眼药水也没有什么效果后来医院检查了一下医生说是晶状体皱缩晶状体皱缩是由什么原因引起的？,				",,,晶状体皱缩是由什么原因引起？
由于眼部炎症或退行性蹭使晶状体营养或代谢发生障碍导致浑浊常见于葡萄膜炎、视网膜色素变性、视网膜脱离、青光眼、眼内肿瘤、高度近视及低眼压等,,晶状体皱缩,"
					,这两天总是感觉眼睛有些不舒服看东西的时候也不清楚跟以前比模糊了好多点了几天的眼药水也没有什么效果后来医院检查了一下医生说是晶状体皱缩晶状体皱缩是由什么原因引起的？,				",,,晶状体皱缩是由什么原因引起？
一般是需要及时的选择有效的抗生素的方法滴眼治疗就可以的。可以使用,,睑结膜充血露...,"
					我的姑舅以前得过青花眼的，整个眼睛都是青青的，看起来非常的可怕，动了手术后就好了的，但后来不知道为什么，也不知道什么时候眼睛就一见风就流泪，眼睛痛，视力明显的下降了，眼睛里还有浓流出来，还发烧头痛。绿脓杆菌性的角膜溃疡注意什么？				",,,绿脓杆菌性角膜溃疡应该注意些什么？
你好，这个就是看眼病对于医院的选择。你也可以考虑几个因素，医院规模实力、医师资质力量、医院设备仪器这些软硬件来权衡分析。如果是正规医院，相关方面都有保障。,,晶状体皱缩,"
					,最近一段时间我感觉视力不如以前了开始我以为是近视但是在医院检查的时候医生说不是仅是疾病得了晶状体皱缩疾病,				",晶状体皱缩是怎样引起的（,,最近一段时间我感觉视力不如以前了开始我以为是近视但...
您好，你说的晶体植入术其实通常称呼为ICL晶体植入术，是将一枚瑞士产的人工晶体植入到眼内，达到屈光矫正近视的目的。针对高度近视非常不错。该技术已经开始15年，在全球很受欢迎。,,晶状体皱缩,"
					,最近一段时间我感觉视力不如以前了开始我以为是近视但是在医院检查的时候医生说不是仅是疾病得了晶状体皱缩疾病,				",晶状体皱缩是怎样引起的（,,最近一段时间我感觉视力不如以前了开始我以为是近视但...
