p_answer1,p_answer2,p_classify,p_qdetail1,p_qdetail2,p_qdetail3,p_title
你好，这最好结合医生治疗，A型肉毒杆菌毒素注射是本病的有效方法。如果肉毒素作用不大，最好及时手术治疗。,,眼睑痉挛,"
					,李学荣，61岁，男，双眼上眼皮合拢无力抬升约6年，经在兰州多家眼科医院治疗无明显效果，后诊断为眼睑痉挛开始打肉毒素，目前效果一般。经兰医一院张新定教授诊断不建议手术，但当前极大影响生活，双眼眼皮基本无力抬升，平时基本闭眼。,				",李学荣，61岁，男，双眼上眼皮合拢无力抬升约6年，经在兰州多家眼科医院治疗无明显效果，后诊断为眼睑痉挛开始打肉毒素，目前效果一般。经兰医一院张新定教授诊断不建议手术，但当前极大影响生活，双眼眼皮基本无力抬升，平时基本闭眼。,诊断，治疗手术。,李学荣，61岁，男，双眼上眼皮合拢无力抬升约6年，经在...
,,眼睑畸形,"
                您好，我朋友前些日子经MRI诊断是：左侧眼眶球后脂肪、左侧眼睑、左侧颧骨、左侧耳廓前、左侧颌面部静脉性的血管畸形，请问该怎么治疗比较好。谢谢！ 多给一些建议。请问眼睑畸形怎么治疗。                ,
            ",,,请问眼睑畸形怎么治疗？
您好，根据您的描述，眼睑痉挛和眼皮下垂松弛是截然相反的症状。眼睑痉挛多是和面神经炎有关，而眼皮下垂松弛，多是和动眼神经麻痹有关。,,眼睑痉挛,"
					眼睑痉挛和眼皮下垂松弛是一个概念吗？				",,,眼睑痉挛和眼皮下垂松弛是一个概
女孩子爱美可以理解首先您要树立信心您这个情况可能是眼底动脉血运中断视网膜后部出现弥漫性灰白色水肿这样形成所谓底樱桃红斑建议注意饮食禁忌辛辣食物及时看医生在医生建议下合理用药物治疗,,眼底樱桃红斑,"
					,近段时间眼睛特别难看也不知道什么原因眼底长红斑跟樱桃一样的颜色难看死了我今年才18岁正好是美好青春年华的好想马上治好啊看着我的女同学每天自信满满的我真的好羡慕眼底樱桃红斑为什么？,				",,,眼底樱桃红斑为什么？
女孩子爱美可以理解首先您要树立信心您这个情况可能是眼底动脉血运中断视网膜后部出现弥漫性灰白色水肿这样形成所谓底樱桃红斑建议注意饮食禁忌辛辣食物及时看医生在医生建议下合理用药物治疗,,眼底樱桃红斑,"
					,近段时间眼睛特别难看也不知道什么原因眼底长红斑跟樱桃一样的颜色难看死了我今年才18岁正好是美好青春年华的好想马上治好啊看着我的女同学每天自信满满的我真的好羡慕眼底樱桃红斑为什么？,				",,,眼底樱桃红斑为什么？
女孩子爱美可以理解首先您要树立信心您这个情况可能是眼底动脉血运中断视网膜后部出现弥漫性灰白色水肿这样形成所谓底樱桃红斑建议注意饮食禁忌辛辣食物及时看医生在医生建议下合理用药物治疗,,眼底樱桃红斑,"
					,近段时间眼睛特别难看也不知道什么原因眼底长红斑跟樱桃一样的颜色难看死了我今年才18岁正好是美好青春年华的好想马上治好啊看着我的女同学每天自信满满的我真的好羡慕眼底樱桃红斑为什么？,				",,,眼底樱桃红斑为什么？
你好因眼底动脉血运中断视网膜后极部出现弥漫性灰白色水肿眼底黄斑中心凹处在周围灰白色水肿区的陪衬下呈现醒目的“樱桃红斑”,,眼底樱桃红斑,"
					,我最近因为加班所以缺少了睡眠但是以前我也经常这样啊也没有哪次像今天这样.我到医院检查说是得了眼底樱红斑这是什么病啊我不太懂.眼底樱红斑是什么病啊,				",,,眼底樱桃红斑是什么病啊
首先采取综合性治疗措施扩张眼本血管恢复血循环血管扩张剂应选择作用快而强者如亚硝酸异戊脂吸入硝酸甘油含化阿托品654-2等球后注射配合物理疗法如热水浴、吸氧、眼球按摩必要时作前房穿刺,,眼底樱桃红斑,"
					,大李前段时间眼睛出现了眼底栅栏红斑在医院住了一段时间现在基本康复了昨天出院的时候医生说一定要以预防为主要不然还会复发的大李相了解一下怎么预防眼底栅桃红斑怎么预防眼底栅桃红斑？,				",,,怎么预防眼底樱桃红斑？
您这个情况可能是眼底动脉血运中断视网膜后部出现弥漫性灰白色水肿这样形成所谓底樱桃红斑建议注意饮食禁忌辛辣食物及时看医生在医生建议下合理用药物治疗,,眼底樱桃红斑,"
					,近段时间眼睛特别难看也不知道什么原因眼底长红斑跟樱桃一样的颜色难看死了我今年才18岁正好是美好青春年华的好想马上治好啊看着我的女同学每天自信满满的我真的好羡慕眼底樱桃红斑为什么？,				",,,眼底樱桃红斑为什么？
出现眼底樱桃红斑是因眼底动脉血运中断视网膜后极部出现弥漫性灰白色水肿眼底黄斑中心凹处在周围灰白色水肿区的陪衬下就会导致呈现醒目的“樱桃红斑建议及时看眼科检查治疗,,眼底樱桃红斑,"
					,大姨本来身体就不好最近眼睛又出现了毛病看东西有时会出现一片混沌看不清仔细看眼睛发现眼眶里有点发肿而且眼底还出现了樱桃一样的红斑点这是什么原因呢？为什么会出现眼底樱桃红斑？,				",,,为什么会出现眼底樱桃红斑？
眼底樱桃红斑是一种综合症的情况可以接受抗氧化剂治疗也可进行脾切除治疗目前已经有治疗好的案例但是还没有特别有效地治疗办法也可以进行胚胎肝移植等,,眼底樱桃红斑,"
					,我的一个侄女以前进行过手术治疗没想到刚恢复不久又出现了眼底樱桃红斑的情况经过检查才知道是一种新型的疾病我们感到很担心好想能够找到有效地治疗办法但是当地的医药队这个病没有治疗的办法眼底樱桃红斑是什么情况呢？怎么治疗？,				",,,眼底樱桃红斑是什么情况呢？
你好：CM1神经节苷脂贮积症采取有效的预防措施避免遗传病后代的出生(即实行优生)和遗传变异的发生通常采取的措施包括：婚前检查遗传咨询产前检查和遗传病的早期治疗,,眼底黄斑部的...,"
					,朋友的一个儿子长得非常的畸形前额突出鼻梁扁平眼间距增宽齿龈肥厚伸舌、短颈和多毛症但是学习成绩还不错原来是患了CM1神经节苷脂贮积症CM1神经节苷脂贮积症如何预防？（感谢医生为我快速解答——点击这里查看整形手术亲身体验效果图）希望医生快速回答,				",,,CM1神经节苷脂贮积症怎么预防翱
,,眼底无红光反...,"
                我最近发觉眼前暗影飘动，或似有红玻璃片遮挡，反复出血，自觉“冒烟”，视力明显下降。眼科检查，在出血较少，不致影响裂隙灯观察时，可以看到红细胞聚集于玻璃体凝胶的支架中，呈柠檬色尘状。中等量的新鲜出血可呈致密的黑色条状混浊。大量出血致眼底无红光反射，视力下降至光感。我该怎么办眼前暗影飘动的原因，治疗建议                ,
            ",,,糖尿病玻璃体出血是由于什么导致的
,,眼底无红光反...,"
                我最近发觉眼前暗影飘动，或似有红玻璃片遮挡，反复出血，自觉“冒烟”，视力明显下降。眼科检查，在出血较少，不致影响裂隙灯观察时，可以看到红细胞聚集于玻璃体凝胶的支架中，呈柠檬色尘状。中等量的新鲜出血可呈致密的黑色条状混浊。大量出血致眼底无红光反射，视力下降至光感。我该怎么办眼前暗影飘动的原因，治疗建议                ,
            ",,,糖尿病玻璃体出血是由于什么导致的
您好，根据您的描述，首先考虑可能是药物的副作用引起的，建议您眼睛已经好转，就最好先停药观察。,,眼睑痉挛,"
					,我在大坪医院检查是眼睑痉挛，吃了药眼睛好转了，就是右面的手脚抖得很厉害。,				",就在许专家那里检查，开的药吃的,我想问一下怎么吃药了右面的手脚抖得很厉害,我在大坪医院检查是眼睑痉挛，吃了药眼睛好转了，就是...
首先采取综合性治疗措施扩张眼本血管恢复血循环血管扩张剂应选择作用快而强者如亚硝酸异戊脂吸入硝酸甘油含化阿托品654-2等球后注射配合物理疗法如热水浴、吸氧、眼球按摩必要时作前房穿刺,,眼底樱桃红斑,"
					,大李前段时间眼睛出现了眼底栅栏红斑在医院住了一段时间现在基本康复了昨天出院的时候医生说一定要以预防为主要不然还会复发的大李相了解一下怎么预防眼底栅桃红斑怎么预防眼底栅桃红斑？,				",,,怎么预防眼底樱桃红斑？
视网膜混浊水肿尤其是后极部但在中心凹可透见其深面的脉络膜桔红色反光在周围灰白色水肿衬托下形成樱桃红斑,,眼底樱桃红斑,"
					,这两天朋友总是感觉自己的眼睛有些不舒服而且视力也没有原来好了有时让他看远处的东西时他总说看不清后来查出他的眼底有樱桃红斑想问下是如何诊断的眼底樱桃红斑应该如何诊断？,				",,,眼底樱桃红斑应该如何诊断？
"眼睑痉挛是神经系统的一种功能性疾病,  建议积极针灸治疗口用",,眼睑痉挛,"
					,您好，病人女67岁，上眼皮睁不动，医院检查说是眼睑痉挛，如果去您那治好治吗,				",在当地检查是眼睑痉挛，药物治疗没什么效果,想去你们医院治疗，不知道这个病是否好治,您好，病人女67岁，上眼皮睁不动，医院检查说是眼睑痉...
如果确诊是单纯眼睑痉挛，建议服用山莨菪碱片观察？或联合苯巴比妥,,眼睑痉挛,"
					患眼睑痉挛六年，主要吃卡马西平和氯硝西泮，有时能控制，有时不能，请问还有什么更好的药吗？				",,,患眼睑痉挛六年，主要吃卡马西平
您好！这样的话需要再去复查一下看看！可以上上热敷！,,眼睑痉挛,"
					你好！由于左眼老想眨眼睛，于是9月25日去了湘雅眼科，医生说根据我的描述有点想眼睑痉挛的症状，于是注射了肉毒毒素，第二天早上起来就发现变成了大小眼了，怎么办？会恢复吗？				",,,你好！由于左眼老想眨眼睛，于是
"您好.这个属于眼睑痉挛造成的情况.注意 避免熬夜.避免生冷刺激性的食物.
口服卡马西平和",,眼睑痉挛,"
					,您好大夫我妹左眼一直跳也没当回事，一直有三年多了今年在阳泉市一院检查说是眼睑痉挛请问大夫能治疗吗？不治疗会不会影响视力？,				",去阳泉和太原检查治疗过 也没有好的效果,请大夫指点吃药还有其他办法，或者去找您  费用大约的多少,您好大夫我妹左眼一直跳也没当回事，一直有三年多了今...
你好本病暂无有效预防措施早发现早诊断是本病防治的关键有波动感则采用平行睑缘切开排脓脓多时置入引流条局部涂抗生素眼膏全身适当使用抗生素、清热解毒中药,,眼睑脓肿,"
					,我的一个同学的姐姐出现脓肿、畏寒、眼睑脓肿、结节很久了的最近越来越严重医生说是患了眼睑疖肿和脓肿的征兆怎么办呢？,				",眼睑疖肿和脓肿如何预防？（,,我的一个同学的姐姐出现脓肿、畏寒、眼睑脓肿、结节很...
你好向您说的，眼睑痉挛，一年多了，时间有点儿长。可以热敷或者口服营养神经的药物，比如,,眼睑痉挛,"
					去年春天发病，诊断为眼睑痉挛，已经影响到正常工作生活请问什么治疗方法效果好，该吃什么药？谢谢！				",,,去年春天发病，诊断为眼睑痉挛，
你好本病暂无有效预防措施早发现早诊断是本病防治的关键有波动感则采用平行睑缘切开排脓脓多时置入引流条局部涂抗生素眼膏全身适当使用抗生素、清热解毒中药,,眼睑脓肿,"
					,我的一个同学的姐姐出现脓肿、畏寒、眼睑脓肿、结节很久了的最近越来越严重医生说是患了眼睑疖肿和脓肿的征兆怎么办呢？,				",眼睑疖肿和脓肿如何预防？（,,我的一个同学的姐姐出现脓肿、畏寒、眼睑脓肿、结节很...
根据您提供的症状考虑是面神经炎的情况，多和面部受凉，病毒感染等有着一定的关联，,,眼睑痉挛,"
					,眼睑痉挛伴随眼部抽搐，难受,				",医院检查后，针灸治疗，疗效不是特别明显,通过医疗手法，能逐渐治愈,眼睑痉挛伴随眼部抽搐，难受
如果头部外伤伤及动眼神经可以造成眼肌麻痹，可以应用营养神经药物治疗，感谢您对我的提问，希望我的回复对您有所帮助，如果还有疑问请继续提问，如果没有了请对我的回复给予评价，祝您早日康复！谢谢！,,眼肌麻痹,"
					摔伤头部可以导致眼肌麻痹吗？干活摔倒了碰到头部，缝了七八针，看东西重影				",,,眼肌麻痹怎么回事
,,眼肌麻痹,"
					四肢痛疼，最近疼痛向腰部胸部发展，有眼肌麻痹和转动痛有闪光。从刚会走路发现畸形，先双脚后手。以前医生认为是发育不好。从18岁开始痛疼(以前都没有)先双脚后双手19岁胸部腰部和眼疼发炎。眼科诊视神经炎和多发性硬化。(做基因检查腓骨肌1A型阳性突变，但无家族史)医生说临床上有很多不符。右脚萎缩比左脚重但双手肌肉无萎缩只轻微畸形，腰部也有肌肉萎缩)说话迟走路迟智力发展选上小学时老师说呆木				",,,做腓肠肌活检要住几天院？
这种情况需要综合判断具体的外伤情况，这种情况有可能有动眼神经损伤，或者是眼外肌损伤，应该进一步检查，,,眼肌麻痹,"
					车祸醒了脑部都没事，眼睛没有明显的伤痕，可是眼睛重影了，一只眼看没事，两只一起看就有重影，出事到现在有15天了，多久能恢复呢				",,,眼肌麻痹怎么办
你好，这个情况下应该和糖尿病有很大的关系，建议最好住院做个全面的检查看看，首先应该排除颅脑内部的病变。,,眼肌麻痹,"
					眼肌麻痹，看东西模糊有重影！				",,,眼肌麻痹，看东西有重影有晕的表现。眼痛
你好本病暂无有效预防措施早发现早诊断是本病防治的关键有波动感则采用平行睑缘切开排脓脓多时置入引流条局部涂抗生素眼膏全身适当使用抗生素、清热解毒中药,,眼睑脓肿,"
					,我的一个同学的姐姐出现脓肿、畏寒、眼睑脓肿、结节很久了的最近越来越严重医生说是患了眼睑疖肿和脓肿的征兆怎么办呢？,				",眼睑疖肿和脓肿如何预防？（,,我的一个同学的姐姐出现脓肿、畏寒、眼睑脓肿、结节很...
你好本病暂无有效预防措施早发现早诊断是本病防治的关键有波动感则采用平行睑缘切开排脓脓多时置入引流条局部涂抗生素眼膏全身适当使用抗生素、清热解毒中药,,眼睑脓肿,"
					,我的一个同学的姐姐出现脓肿、畏寒、眼睑脓肿、结节很久了的最近越来越严重医生说是患了眼睑疖肿和脓肿的征兆怎么办呢？,				",眼睑疖肿和脓肿如何预防？（,,我的一个同学的姐姐出现脓肿、畏寒、眼睑脓肿、结节很...
你好本病暂无有效预防措施早发现早诊断是本病防治的关键有波动感则采用平行睑缘切开排脓脓多时置入引流条局部涂抗生素眼膏全身适当使用抗生素、清热解毒中药,,眼睑脓肿,"
					,我的一个同学的姐姐出现脓肿、畏寒、眼睑脓肿、结节很久了的最近越来越严重医生说是患了眼睑疖肿和脓肿的征兆怎么办呢？,				",眼睑疖肿和脓肿如何预防？（,,我的一个同学的姐姐出现脓肿、畏寒、眼睑脓肿、结节很...
这种情况人如果眼睑部位引起红肿疼痛，导致化脓的感染一般很难短时间恢复的。,,眼睑脓肿,"
					我的一个同学的姐姐出现脓肿、畏寒、眼睑脓肿、结节很久了的，最近越来越严重，医生说是患了眼睑疖肿和脓肿的征兆，怎么办呢？眼睑疖肿和脓肿如何预防？				",,,眼睑疖肿和脓肿如何预防有效呢？
你好本病暂无有效预防措施早发现早诊断是本病防治的关键有波动感则采用平行睑缘切开排脓脓多时置入引流条局部涂抗生素眼膏全身适当使用抗生素、清热解毒中药,,眼睑脓肿,"
					,我的一个同学的姐姐出现脓肿、畏寒、眼睑脓肿、结节很久了的最近越来越严重医生说是患了眼睑疖肿和脓肿的征兆怎么办呢？,				",眼睑疖肿和脓肿如何预防？（,,我的一个同学的姐姐出现脓肿、畏寒、眼睑脓肿、结节很...
你好，本病暂无有效预防措施，早发现早诊断是本病防治的关键。有波动感则采用平行睑缘切开排脓，脓多时置入引流条，局部涂抗生素眼膏全身适当使用抗生素、清热解毒中药。,,眼睑脓肿,"
					我同桌的爷爷住在乡下，他老人家也上年纪了的，最近听说身体不是很好的，出现疖肿溃疡脓肿畏寒眼睑脓肿结节的情况，医生说有可能是患了眼睑疖肿和脓肿，怎么办才呢？眼睑疖肿和脓肿如何预防？				",,,眼睑疖肿和脓肿如何预防？
你好，本病暂无有效预防措施，早发现早诊断是本病防治的关键。有波动感则采用平行睑缘切开排脓，脓多时置入引流条，局部涂抗生素眼膏全身适当使用抗生素、清热解毒中药。,,眼睑脓肿,"
					我同桌的爷爷住在乡下，他老人家也上年纪了的，最近听说身体不是很好的，出现疖肿溃疡脓肿畏寒眼睑脓肿结节的情况，医生说有可能是患了眼睑疖肿和脓肿，怎么办才呢？眼睑疖肿和脓肿如何预防？				",,,眼睑疖肿和脓肿如何预防？
这种情况考虑眼睑疖肿可以注意清洁卫生，医院眼科检查，可以手术引流，应用消炎药物治疗观察,,眼睑脓肿,"
					隔壁的张大叔感觉自己最近听说身体不是很好的，出现疖肿溃疡脓肿畏寒眼睑脓肿结节的情况，医生说有可能是患了眼睑疖肿和脓肿，这个病的症状是什么呢？这个病的症状是什么呢？				",,,眼睑疖肿和脓肿？
你好朋友很高兴为您解答，这个是可能是宝宝有些上火引起的吧，,,眼睑松弛,"
					,医生，你好。我家宝宝出生后眼睛流泪长眼屎，进行按摩内眼角，由于按摩手法有误，导致下眼睑松弛，有皱纹，以后能长好吗？会恢复吗？谢谢				",,,医生，你好。我家宝宝出生后眼睛流泪长眼屎，进行按摩...
你好，目前最快速有效的方法就是做手术，但是不排除还是会长的可能，因为做完肯定是要保养得。,,眼睑松弛,"
					我的眼袋好像长了好几年了，不管是睡好还是没睡好都严重，所以看起来很没精神，不知道怎么办才好，想动手术，他们说如果熬夜的话又会长起来，而且会下眼睑松弛，如果不动手术，又不知道什么办法才能去掉它，苦闷，求帮助，				",,,我的眼袋好像长了好几年了，不管
隆鼻术就是用特殊的材料将低平、内凹的鼻梁垫高的手术方式。也是整形外科领域最常见和成熟的一种手术。,,眼睑松弛,"
					,您好，王医生，我想做双眼皮手术，个人情况是单眼皮，上眼睑松弛，脂肪较多。其一，想问您手术费大约需要多少钱；其二想问您，只有您坐班的周三才能手术吗；其三想问，春节期间您是不是不坐班的？,				",双眼皮手术,,您好，王医生，我想做双眼皮手术，个人情况是单眼皮，...
"你好，这种情况建议您应注意保证充足睡眠、提高睡眠质量、睡前少喝水.经常按摩眼睑,促进血液循环.多吃富含维生素a和b的食 品,如 胡萝卜,马铃薯,豆制品和动物的肝脏.",,眼睑松弛,"
					下眼睑松弛可以治疗好嘛				",,,下眼睑松弛可以治疗好嘛
你好，我们 医院费用双眼皮，眼角，下眼袋，需要预约，欢迎来院面诊；我出诊地址：哈医大一院群力新院区  哈市道理区群力第七大道和丽江路口；或在本网站预约。,,眼睑松弛,"
					,你好，我想做切眼袋开眼角和上眼睑松弛。一共多少钱,				",咨询一下价格,,你好，我想做切眼袋开眼角和上眼睑松弛。一共多少钱
你好，下睑外翻这种情况是可以通过手术来矫正的，但是具体是否需要手术以及手术方式的设计必须经过面诊检查才能确定。,,眼睑外翻,"
					有轻微的下眼睑外翻。请问医生能解决吗。				",,,有轻微的下眼睑外翻。请问医生能
,,眼睑松弛,"
					24有严重黑眼圈！皮肤松弛！眼睑松弛！怎么调理！我不想整容				",,,严重黑眼圈皮肤松弛怎样治？
现在可以热敷，但孩子太小以免烫伤。睑外翻将来有可能会好转，如果程度严重的话，等孩子大些可以考虑手术。,,眼睑外翻,"
					孩子2岁9个月，右眼下眼皮外做麦粒肿手术一个月了，疤痕的地方还有一点红，有轻微眼睑外翻，请问如何护理可以热敷吗？能否帮助促进疤痕软化和消除，另外长大一些眼睑外翻现象能否好转或必须要做矫正治疗，何时做比较合适				",,,孩子2岁9个月，右眼下眼皮外做
"你好. 应该是需要手术治疗的. 生活上应该减少刺激性食物,忌油腻，忌腥荤,平时注意避免劳累，多食蔬菜水果，积极 补充维生素C",,眼睑松弛,"
					下眼睑松弛导致泪点外翻怎么医治呢？医师				",,,下眼睑松弛导致泪点外翻怎么医治
你好可以考虑滴用抗生素眼药水及眼膏治疗，还有热敷治疗。外翻如果不是先天性的导致，可以消肿后自愈,,眼睑外翻,"
					孩子快三岁了，右眼上个月做了麦粒肿手术，疤痕的地方还有一点红，两眼下眼睑不对称，右眼下眼睑有轻微眼睑外翻，请问如何护理可以热敷吗？如何能否帮助促进疤痕软化和消除，另外眼睑外翻长大后能否有可能好转呢				",,,孩子快三岁了，右眼上个月做了麦
轻度下睑外翻可以向上轻拉眼角，有的人有效果,,眼睑外翻,"
					医生，我有轻微的下眼睑外翻，请问能解决吗。				",,,医生，我有轻微的下眼睑外翻，请
下睑外翻影响泪液排出导致流泪，可以考虑手术矫正，平时向上擦眼,,眼睑外翻,"
					有些下眼睑外翻，能解决吗医生。				",,,有些下眼睑外翻，能解决吗医生。
,,眼睑外翻,"
					真是下眼睑外翻吗。。感觉下眼皮很松弛				",,,真是下眼睑外翻吗。。感觉下眼皮很松...
这个没有啊。是不是眼睑皮肤有些肿，多休息。用玻璃酸钠眼药水滋润一下。,,眼睑外翻,"
					是眼睑外翻吗？。。。。下眼皮感觉挺松弛				",,,是眼睑外翻吗？。。。。下眼皮感觉...
这个没有啊。是不是眼睑皮肤有些肿，多休息。用玻璃酸钠眼药水滋润一下。,,眼睑外翻,"
					是眼睑外翻吗？。。。。下眼皮感觉挺松弛				",,,是眼睑外翻吗？。。。。下眼皮感觉...
这个没有啊。是不是眼睑皮肤有些肿，多休息。用玻璃酸钠眼药水滋润一下。,,眼睑外翻,"
					是眼睑外翻吗？。。。。下眼皮感觉挺松弛				",,,是眼睑外翻吗？。。。。下眼皮感觉...
这种情况手术后拆线11天应该是可以愈合了，拆线后一般肿胀可以逐渐消退的。不可能再引起感染了。,,眼睑外翻,"
					眼睑外翻术后肿肿的，已拆线11天如果热敷会感染伤口吗				",,,眼睑外翻术后肿肿的，已拆线11
您好！不好意思，不知道您具体是要问什么问题？。建议您，上传资料时，一定要对病情叙述全面、完整，包括检查的资料等。,,眼底点状或火...,"
					双眼糖尿病性视网膜病变，右眼出现新增血管、斑点状出血遮蔽荧光、大量激光斑				",,,糖尿病眼底病变
这个糖尿病视网膜病变，治疗方案已经比较成熟了，各个医院的治疗都差不多，可以去华西,,眼底点状或火...,"
					有糖尿病6-7年，最近几个月感觉眼睛视力下降，去医院检查就说是糖尿病性视网膜病变，请问在华西治疗方案是否一样。				",,,糖尿病性视网膜病变的治疗方法
,,眼底点状或火...,"
					糖尿病，高血压2年一直吃药，最近一个月视力下降明显，刚检查出糖尿病性玻璃体出血，糖尿病性视网膜病变，医生建议住院手术。                   咨询专家能否不做手术，其他治疗方法。				",,,糖尿病，高血压2年一直吃药，最近一...
您好，可以激光治疗，同时好好控制血糖，建议少吃含糖量高的食物，水果放在两餐中间吃。餐后运动半小时，还需要检测血糖。,,眼底点状或火...,"
					什么是眼内注射雷珠单，她这种需要打针不。可以直接做激光或者用药不				",,,糖尿病性视网膜病变怎么治疗
