p_answer1,p_answer2,p_classify,p_qdetail1,p_qdetail2,p_qdetail3,p_title
视神经萎缩是视神经病损的最终结果表现为视神经纤维的变性和消失传导功能障碍出现视野变化视力减退并丧失一般分为原发性和继发性两类针灸主要治疗原发性和炎症引起的继发性视神经萎缩除上述症状外眼底检查尚可见视乳头颜色为淡黄或苍白色境界模糊生理凹陷消失血管变细等现代西医学对本病尚缺乏特效疗法,,视神经的原发...,"
					,我奶奶一直患有高血压最近她的视力好像下降了然后我们就带她去医院检查医生说是高血压引起的视神经的原发性萎缩高血压引起的视神经的原发性萎缩是怎么回事？,				",,,高血压引起视神经的原发性萎缩可以治愈吗？
根据你的叙述是比较严重的损伤了动眼神经,,视近困难,"
					,眼外伤导致瞳孔括约肌断裂晶体半脱位求帮助2013年1月18日下午4点打篮球被人戳伤左眼当时瞳孔放大约7mm视力很差看东西像隔着雾一样很朦胧并且看出去视觉不水平17点赶到浙江省人民医院急诊医生诊断为外伤性瞳孔散大5mm角膜裂伤晶体半脱位抖动于是给我打破伤风和消炎输液在18点时感觉头晕恶心输液完毕到家晚上20点雾感稍缓解头晕恶心好转但是视力下降配了贝复舒滴眼液、氟美瞳滴眼液、可乐必妥眼水2013年1月19日早上醒来画面水平一致视力恢复90%稍有下降50度（原来左眼视力250度受伤后300度）没有雾感上午赶到浙二医院眼科中心瞳孔散大5mm于是做了一系列检查:b超、眼压、视野视力等基本都正常配了一些药品:强的松片、甲钴胺片、胰激肽原酶肠溶片、复明胶囊2013年1月21日下午到浙二医院眼科中心林季建主任医师就诊瞳孔括约肌9-12点方向断裂晶体半脱位震颤提示注意眼压未配药目前主要症状眼睛积血有所好转伤眼视力下降50度视近困难有些畏光伤眼左右看会感觉到极轻微的光线抖动画面不抖动感觉是晶状体抖动带来的光线变化这种半脱位属于比较轻微的吗？视力没有受太大影响画面清晰伤眼的瞳孔在一般室内最小是5mm但是在黑暗环境仍然能变大来看清楚物体因为在突然进入黑暗的时候伤眼跟健眼一样一瞬间是什么都看不见但是能感觉到伤眼通过调节瞳孔来适应黑暗中的物体,				",就诊三次基本诊断为瞳孔括约肌断裂晶体震颤,因为刚受伤5天实在不知道该如何面对今后的生活感觉一片迷茫希望徐医师能在百忙之中抽空帮助指点:1、视近困难通过休息治疗是否会好转？如会好转大约需要多久？2、我这情况的晶体抖动属于比较轻微的吗？是否是悬韧带松弛今后有没可能自行恢复？3、晶体震颤要告别激烈运动那一般的跑步运动是否也要停止吗？4、晶体半脱位如果一旦发展成全脱位一般建议什么手术？（）,眼外伤导致瞳孔括约肌断裂晶体半脱位求帮助2013年1月1...
根据你的叙述是比较严重的损伤了动眼神经,,视近困难,"
					,眼外伤导致瞳孔括约肌断裂晶体半脱位求帮助2013年1月18日下午4点打篮球被人戳伤左眼当时瞳孔放大约7mm视力很差看东西像隔着雾一样很朦胧并且看出去视觉不水平17点赶到浙江省人民医院急诊医生诊断为外伤性瞳孔散大5mm角膜裂伤晶体半脱位抖动于是给我打破伤风和消炎输液在18点时感觉头晕恶心输液完毕到家晚上20点雾感稍缓解头晕恶心好转但是视力下降配了贝复舒滴眼液、氟美瞳滴眼液、可乐必妥眼水2013年1月19日早上醒来画面水平一致视力恢复90%稍有下降50度（原来左眼视力250度受伤后300度）没有雾感上午赶到浙二医院眼科中心瞳孔散大5mm于是做了一系列检查:b超、眼压、视野视力等基本都正常配了一些药品:强的松片、甲钴胺片、胰激肽原酶肠溶片、复明胶囊2013年1月21日下午到浙二医院眼科中心林季建主任医师就诊瞳孔括约肌9-12点方向断裂晶体半脱位震颤提示注意眼压未配药目前主要症状眼睛积血有所好转伤眼视力下降50度视近困难有些畏光伤眼左右看会感觉到极轻微的光线抖动画面不抖动感觉是晶状体抖动带来的光线变化这种半脱位属于比较轻微的吗？视力没有受太大影响画面清晰伤眼的瞳孔在一般室内最小是5mm但是在黑暗环境仍然能变大来看清楚物体因为在突然进入黑暗的时候伤眼跟健眼一样一瞬间是什么都看不见但是能感觉到伤眼通过调节瞳孔来适应黑暗中的物体,				",就诊三次基本诊断为瞳孔括约肌断裂晶体震颤,因为刚受伤5天实在不知道该如何面对今后的生活感觉一片迷茫希望徐医师能在百忙之中抽空帮助指点:1、视近困难通过休息治疗是否会好转？如会好转大约需要多久？2、我这情况的晶体抖动属于比较轻微的吗？是否是悬韧带松弛今后有没可能自行恢复？3、晶体震颤要告别激烈运动那一般的跑步运动是否也要停止吗？4、晶体半脱位如果一旦发展成全脱位一般建议什么手术？（）,眼外伤导致瞳孔括约肌断裂晶体半脱位求帮助2013年1月1...
根据你的叙述是比较严重的损伤了动眼神经建议到正规医院进行修复服用毛果云香碱防止粘连,,视近困难,"
					,眼外伤导致瞳孔括约肌断裂晶体半脱位求帮助2013年1月18日下午4点打篮球被人戳伤左眼当时瞳孔放大约7mm视力很差看东西像隔着雾一样很朦胧并且看出去视觉不水平17点赶到浙江省人民医院急诊医生诊断为外伤性瞳孔散大5mm角膜裂伤晶体半脱位抖动于是给我打破伤风和消炎输液在18点时感觉头晕恶心输液完毕到家晚上20点雾感稍缓解头晕恶心好转但是视力下降配了贝复舒滴眼液、氟美瞳滴眼液、可乐必妥眼水2013年1月19日早上醒来画面水平一致视力恢复90%稍有下降50度（原来左眼视力250度受伤后300度）没有雾感上午赶到浙二医院眼科中心瞳孔散大5mm于是做了一系列检查:b超、眼压、视野视力等基本都正常配了一些药品:强的松片、甲钴胺片、胰激肽原酶肠溶片、复明胶囊2013年1月21日下午到浙二医院眼科中心林季建主任医师就诊瞳孔括约肌9-12点方向断裂晶体半脱位震颤提示注意眼压未配药目前主要症状眼睛积血有所好转伤眼视力下降50度视近困难有些畏光伤眼左右看会感觉到极轻微的光线抖动画面不抖动感觉是晶状体抖动带来的光线变化这种半脱位属于比较轻微的吗？视力没有受太大影响画面清晰伤眼的瞳孔在一般室内最小是5mm但是在黑暗环境仍然能变大来看清楚物体因为在突然进入黑暗的时候伤眼跟健眼一样一瞬间是什么都看不见但是能感觉到伤眼通过调节瞳孔来适应黑暗中的物体就诊三次基本诊断为瞳孔括约肌断裂晶体震颤因为刚受伤5天实在不知道该如何面对今后的生活感觉一片迷茫希望徐医师能在百忙之中抽空帮助指点:1、视近困难通过休息治疗是否会好转？如会好转大约需要多久？2、我这情况的晶体抖动属于比较轻微的吗？是否是悬韧带松弛今后有没可能自行恢复？3、晶体震颤要告别激烈运动那一般的跑步运动是否也要停止吗？4、晶体半脱位如果一旦发展成全脱位一般建议什么手术？,				",,,眼外伤导致瞳孔括约肌断裂晶体半脱位求帮
,,视近困难,"
					,2013年1月18日下午16点打篮球被人戳伤左眼当时瞳孔放大视力很差看东西像隔着雾一样很朦胧并且看出去视觉不水平17点赶到浙江省人民医院急诊医生诊断为外伤性瞳孔散大5mm角膜裂伤晶体半脱位抖动于是给我打破伤风和消炎输液在18点时感觉头晕恶心输液完毕到家晚上20点雾感稍缓解头晕恶心好转但是视力下降配了贝复舒滴眼液、氟美瞳滴眼液、可乐必妥眼水2013年1月19日早上醒来画面水平一致视力恢复90%没有雾感上午赶到浙二医院眼科中心伤眼矫正视力0.8瞳孔散大5mm于是做了一系列检查:b超（玻璃体混浊但未发现网脱）、眼压（左眼11.5右眼14.5）、视野视力等基本都正常配了一些药品:强的松片、甲钴胺片、胰激肽原酶肠溶片、复明胶囊2013年1月21日下午到浙二医院眼科中心林季建主任医师就诊瞳孔括约肌9-12点方向断裂晶体半脱位震颤提示注意眼压未配药2013年1月29日复诊瞳孔9-12点断断续续括约肌断裂并非完全断裂医生说伤口已经长好眼压（左14.0右15.0）矫正视力1.0晶体轻微震颤属于比较轻微的半脱位另外配了一点维生素B1B6复方芦丁片目前受伤2周后主要症状眼睛积血基本吸收还余下一点点血估计3-4天后可以完全消除伤眼矫正视力提高到1.0因散瞳视近困难畏光感已经消除伤眼的瞳孔在一般室内最小是5mm但是在黑暗环境能变大来看清楚物体反应速度跟健眼一致能感觉到伤眼通过调节瞳孔来适应黑暗中的物体,				",已写在病情描述中,希望徐医生百忙之中抽空答复下几个问题对我真的很重要先说声谢谢了1、我这情况的晶体的轻微震颤今后有没可能自行恢复？2、晶体轻微震颤不能激烈运动那今后跑步运动也不行了吗？因为运动是一直保持我乐观心态的动力3、在电脑前眼角偶尔会出现闪光感晚上闭眼也会有但是受伤第二天做眼部b超并没发现问题受伤10天后反而出现闪光感为了测试是否玻璃体牵拉视网膜我把眼珠大幅度转动都不会出现闪光有时候眼睛盯着一个位置不动也会有闪光感这还有可能是什么原因引起的？4、另外甲钴胺片我一直在吃这药一直吃有没有什么影响？吃到什么时候可以停药？临近春节祝徐医生蛇年身体健康万事如意给您拜年了,2013年1月18日下午16点打篮球被人戳伤左眼当时瞳孔放大...
视网膜色素变性是一种遗传性的渐进性损害视力的一种疾病，主要表现为夜盲，视野缩小，生理盲点扩大说明视野有缩小。,,生理盲点扩大,"
					我被诊断为双眼视网膜色素变性，左眼生理盲点扩大，上方呈扇形缺损，有什么好的办法治疗吗				",,,我被诊断为双眼视网膜色素变性，左眼生理盲点扩大
根据你说的情况，视网膜色素变性，属于遗传性疾病，目前没有特别好的治疗方法,,生理盲点扩大,"
					我被诊断为双眼视网膜色素变性，左眼生理盲点扩大，上方呈扇形缺损，有什么好的办法治疗吗				",,,我被诊断为双眼视网膜色素变性，左眼生理盲点扩大
您好，视网膜色素变性属于先天遗传性疾病，一般双眼发病，不同病人预后不同。,,生理盲点扩大,"
					我被诊断为双眼视网膜色素变性，左眼生理盲点扩大，上方呈扇形缺损，有什么好的办法治疗吗				",,,我被诊断为双眼视网膜色素变性，左眼生理盲点扩大
根据你的叙述是比较严重的损伤了动眼神经,,视近困难,"
					,眼外伤导致瞳孔括约肌断裂晶体半脱位求帮助2013年1月18日下午4点打篮球被人戳伤左眼当时瞳孔放大约7mm视力很差看东西像隔着雾一样很朦胧并且看出去视觉不水平17点赶到浙江省人民医院急诊医生诊断为外伤性瞳孔散大5mm角膜裂伤晶体半脱位抖动于是给我打破伤风和消炎输液在18点时感觉头晕恶心输液完毕到家晚上20点雾感稍缓解头晕恶心好转但是视力下降配了贝复舒滴眼液、氟美瞳滴眼液、可乐必妥眼水2013年1月19日早上醒来画面水平一致视力恢复90%稍有下降50度（原来左眼视力250度受伤后300度）没有雾感上午赶到浙二医院眼科中心瞳孔散大5mm于是做了一系列检查:b超、眼压、视野视力等基本都正常配了一些药品:强的松片、甲钴胺片、胰激肽原酶肠溶片、复明胶囊2013年1月21日下午到浙二医院眼科中心林季建主任医师就诊瞳孔括约肌9-12点方向断裂晶体半脱位震颤提示注意眼压未配药目前主要症状眼睛积血有所好转伤眼视力下降50度视近困难有些畏光伤眼左右看会感觉到极轻微的光线抖动画面不抖动感觉是晶状体抖动带来的光线变化这种半脱位属于比较轻微的吗？视力没有受太大影响画面清晰伤眼的瞳孔在一般室内最小是5mm但是在黑暗环境仍然能变大来看清楚物体因为在突然进入黑暗的时候伤眼跟健眼一样一瞬间是什么都看不见但是能感觉到伤眼通过调节瞳孔来适应黑暗中的物体,				",就诊三次基本诊断为瞳孔括约肌断裂晶体震颤,因为刚受伤5天实在不知道该如何面对今后的生活感觉一片迷茫希望徐医师能在百忙之中抽空帮助指点:1、视近困难通过休息治疗是否会好转？如会好转大约需要多久？2、我这情况的晶体抖动属于比较轻微的吗？是否是悬韧带松弛今后有没可能自行恢复？3、晶体震颤要告别激烈运动那一般的跑步运动是否也要停止吗？4、晶体半脱位如果一旦发展成全脱位一般建议什么手术？（）,眼外伤导致瞳孔括约肌断裂晶体半脱位求帮助2013年1月1...
你好，视网膜色素变性和遗传有关，是一组致盲眼病，也有散发病例，一般在儿童或青少年时期发病，累及双眼。临床表现也盲，随着病情的发展视力逐渐下降，视野逐渐缩小，最后失明。,,生理盲点扩大,"
					我今年38岁。诊断为双眼视网膜色素变性，视野测试结果左眼生理盲点扩大，上方呈扇形缺损。				",,,我今年38岁。诊断为双眼视网膜色素变性，
　1.肿瘤早期部分病例可有视物变形、变色个别病例表现远视度数持续增加提示后极部脉络膜有占位性病变将视网膜向前推移　　2.恶性黑色素瘤的视野缺损大于肿瘤的实际面积蓝色视野缺损大于红色视野缺损　　3.脉络膜黑色素瘤邻近处的角膜知觉可以减退虹膜可合并有虹膜痣虹膜新生血管瞳孔缘色素外翻肿瘤坏死时可合并有虹膜睫状体炎、前房积脓、前房色素沉积、前房积血等,,前房色素沉积,"
					,最近一段时间不知道是怎么回事老是感觉浑身不舒服尤其是眼部看东西开始有些模糊而且时间稍微长一点就会感觉眼睛很痛一开始以为是用眼过度造成的可是休息之后也没有任何的好转去医院做了相关的检查之后医生说有前方色素沉积的现象要及时的进行治疗才行前方色素沉积有哪些并发症？（感谢医生为我快速解答——点击这里查看整形手术亲身体验效果图）希望医生快速回答,				",,,前房色素沉积的并发症
,,视网膜水肿,"
					,医生您好。我父亲得了特殊的葡萄膜炎视网膜水肿，去市医院就诊了，医生给开了些药物，病情得到缓解。其中有醋酸泼泥松片，我父亲因为外出一段时间，停了几天要，结果出现了头晕、四肢无力的症状，甚至有一次直接掉进河里去了，半天都爬不上来。开药的医生说醋酸泼泥松片是激素药，建议父亲不要多吃，我想问一下有没有什么药能够替代醋酸泼泥松片？我爸现在这样子弄得我们家里人都特别难受，有没有更好的治疗办法呢？,				",医生开过醋酸泼泥松片和氯化钾。,有没有更好的药物或者更好的办法呢？谢谢医生了！,医生您好。我父亲得了特殊的葡萄膜炎视网膜水肿，去市...
这是一种眼底病，常见于青年人，目前病因尚不明确，以眼球转动疼痛，视力下降为主要症状，激素为主要治疗方法,,生理盲点扩大,"
					视力下降10余天，哺乳期两个月，眼底检查视乳头水肿3-4D，静脉迂曲，视野变现生理盲点扩大未治激素用多大量，多长时间，用哪一类				",,,哺乳期视神经炎的治疗
您描述的生理盲点扩大是由于先天性，遗传性的视网膜色素变性导致的视野缺损，一般还会伴有夜盲。,,生理盲点扩大,"
					我被诊断为双眼视网膜色素变性，左眼生理盲点扩大，上方呈扇形缺损，有什么好的办法治疗吗				",,,我被诊断为双眼视网膜色素变性，左眼生理盲点扩大
你好，根据你的近视情况双眼都属于高度近视了，高度近视治疗一般考虑ICL或者激光手术。近视手术需要多少钱？在于你适合哪种手术需要检查确定，费用是因为方式不同也不同。,,内斜V征,"
					,我家儿子就快上高中了因为他有近视就想带他去做矫正手术就去医院做了相关检查医生说他有内斜V征我不懂就想了解内斜V征的并发症,				",内斜V征的并发症有哪些呢？（,,我家儿子就快上高中了因为他有近视就想带他去做矫正手...
你好，根据你的近视情况双眼都属于高度近视了，高度近视治疗一般考虑ICL或者激光手术。近视手术需要多少钱？在于你适合哪种手术需要检查确定，费用是因为方式不同也不同。,,内斜V征,"
					,我家儿子就快上高中了因为他有近视就想带他去做矫正手术就去医院做了相关检查医生说他有内斜V征我不懂就想了解内斜V征的并发症,				",内斜V征的并发症有哪些呢？（,,我家儿子就快上高中了因为他有近视就想带他去做矫正手...
你好少吃辛辣刺激性食物如酒辣椒某些微量金属元素而使体内酪氨酸酶活性降低影响了黑色素的合成代谢从而产生蹭因此患者应多吃含铜锌铁等金属元素较多的食品使酪氨酸酶活性增强继而使黑色素合成加快,,内斜V征,"
					,我不知道是怎么了我患病了我检查出患了内斜V征了我不知道这个病是不是好治疗呢会不会有什么好的方法可以治愈呢我不清楚要注意些什么了我不知道是不是可以治疗好呢我非常的着急我的病很担心,				",内斜V征要注意什么？（,,我不知道是怎么了我患病了我检查出患了内斜V征了我不知...
你好，根据你的近视情况双眼都属于高度近视了，高度近视治疗一般考虑ICL或者激光手术。近视手术需要多少钱？在于你适合哪种手术需要检查确定，费用是因为方式不同也不同。,,内斜V征,"
					,我家儿子就快上高中了因为他有近视就想带他去做矫正手术就去医院做了相关检查医生说他有内斜V征我不懂就想了解内斜V征的并发症,				",内斜V征的并发症有哪些呢？（,,我家儿子就快上高中了因为他有近视就想带他去做矫正手...
你好，少吃辛辣刺激性食物如酒辣椒某些微量金属元素而使体内酪氨酸酶活性降低影响了黑色素的合成代谢从而产生蹭，因此患者应多吃含铜锌铁等金属元素较多的食品使酪氨酸酶活性增强继而使黑色素合成加快,,内斜V征,"
					,我不知道是怎么了我患病了我检查出患了内斜V征了我不知道这个病是不是好治疗呢会不会有什么好的方法可以治愈呢我不清楚要注意些什么了我不知道是不是可以治疗好呢我非常的着急我的病很担心,				",内斜V征要注意什么？（,,我不知道是怎么了我患病了我检查出患了内斜V征了我不知...
你好，少吃辛辣刺激性食物如酒辣椒某些微量金属元素而使体内酪氨酸酶活性降低影响了黑色素的合成代谢从而产生蹭，因此患者应多吃含铜锌铁等金属元素较多的食品使酪氨酸酶活性增强继而使黑色素合成加快,,内斜V征,"
					,我不知道是怎么了我患病了我检查出患了内斜V征了我不知道这个病是不是好治疗呢会不会有什么好的方法可以治愈呢我不清楚要注意些什么了我不知道是不是可以治疗好呢我非常的着急我的病很担心,				",内斜V征要注意什么？（,,我不知道是怎么了我患病了我检查出患了内斜V征了我不知...
你好，少吃辛辣刺激性食物如酒辣椒某些微量金属元素而使体内酪氨酸酶活性降低影响了黑色素的合成代谢从而产生蹭，因此患者应多吃含铜锌铁等金属元素较多的食品使酪氨酸酶活性增强继而使黑色素合成加快,,内斜V征,"
					,我不知道是怎么了我患病了我检查出患了内斜V征了我不知道这个病是不是好治疗呢会不会有什么好的方法可以治愈呢我不清楚要注意些什么了我不知道是不是可以治疗好呢我非常的着急我的病很担心,				",内斜V征要注意什么？（,,我不知道是怎么了我患病了我检查出患了内斜V征了我不知...
你好，少吃辛辣刺激性食物如酒辣椒某些微量金属元素而使体内酪氨酸酶活性降低影响了黑色素的合成代谢从而产生蹭，因此患者应多吃含铜锌铁等金属元素较多的食品使酪氨酸酶活性增强继而使黑色素合成加快,,内斜V征,"
					,我不知道是怎么了我患病了我检查出患了内斜V征了我不知道这个病是不是好治疗呢会不会有什么好的方法可以治愈呢我不清楚要注意些什么了我不知道是不是可以治疗好呢我非常的着急我的病很担心,				",内斜V征要注意什么？（,,我不知道是怎么了我患病了我检查出患了内斜V征了我不知...
您好，看眼睛哪家医院好？实际上，现在激光手术发展已经趋于成熟，设备方面不断在创新升级，医师经验以及安全保障都与以前标准不一样了，找到正规眼科医院就可以。,,内斜V征,"
					,我家儿子就快上高中了因为他有近视就想带他去做矫正手术就去医院做了相关检查医生说他有内斜V征我不懂就想了解内斜V征的并发症,				",内斜V征的并发症有哪些呢？（,,我家儿子就快上高中了因为他有近视就想带他去做矫正手...
大三阳表示乙肝病毒处于活跃状况，并不代表有严重肝细胞损害。这时症状大多体现在除肝脏外的其它器官上，像蜘蛛 痣、眼珠发黄、面色发黄，发黑、食欲不振，厌食，恶心，厌油腻等现象，常用干扰素、核苷类药 物治疗，也可以中医调理。,,葡萄膜炎,"
					我有乙肝大三阳还有葡萄膜炎现在左眼视线光敢怎么办呢？				",,,我有乙肝大三阳还有葡萄膜炎现在
你好，有出现眼睛发红以及流眼泪的现象，不排除与你所说的红眼病有关系，多是由于病毒或者细菌感染导致结膜炎引起的。,,葡萄膜炎,"
					孩子19岁、女、几个月就起麦粒肿、直到现孩子19岁、女、几个月就起麦粒肿、直到现在、在这几年间、眼睛出现各种问题、肉芽增生、结膜炎、角膜炎、葡萄膜炎、等等……现在是睑缘炎、螨虫感染、孩子眼睛留下了瘢痕、我现在最大的愿望就是给孩子治好眼睛、求求大夫、我会感谢你的、先在此感谢!				",,,孩子19岁、女、几个月就起麦粒肿、直到现
"你好!建化去北京正规医院治疗,以免延误孩子的病情.祝孩子宇康复",,葡萄膜炎,"
					小孩葡萄膜炎能冶好吗？我的小孩2008年开始一直到现在都在看，这病时好时坏也不知道怎么办呢？				",,,小孩葡萄膜炎能冶好吗？我的小孩
"生理性玻璃体浑浊,不影响视力,无需治疗.玻璃体浑浊影响视力.治疗以加速眼部微循环,增强眼睛滋养, 用 中医保 守疗法.短期内可以恢复,无副作用.",,葡萄膜炎,"
					,您好，我是黑龙江的患者，经几家省内医院确诊右眼为葡萄膜炎和玻璃体混浊，用了一段口服激素，现在效果不明显，很苦恼，请问您有什么好办法吗,				",在哈医大一院，二院，及爱尔眼科医院做过治疗,该怎么治疗，见效快,您好，我是黑龙江的患者，经几家省内医院确诊右眼为葡...
角膜炎的类型众多，还是到医院确诊后再行治疗比较稳妥。不是顽疾，一般都可以治愈。角膜炎是临床上常见的一种眼科疾病。是角膜上患的一种急、慢性炎症。,,葡萄膜炎,"
					你好，我爸的眼睛葡萄膜炎，炎症很严重，一直得不到控制，现在已经看不见东西了，眼睛里面有一层乳白色的东西，不知道应该挂哪位专家号比较合适。				",,,你好，我爸的眼睛葡萄膜炎，炎症
您好，长时间对电脑用眼，肯定会对视力有影响，根据您描述还不能够十分肯定就是近视眼，也可能其他眼病引起。近视眼的症状里面就存在视物模糊的感觉。如果是近视眼，那么应该根据情况进行近视治疗。,,内斜V征,"
					,我家儿子就快上高中了因为他有近视就想带他去做矫正手术就去医院做了相关检查医生说他有内斜V征我不懂就想了解内斜V征的并发症,				",内斜V征的并发症有哪些呢？（,,我家儿子就快上高中了因为他有近视就想带他去做矫正手...
